{"$schema":"https://json-schema.org/draft/2020-12/schema","title":"LazySeries Host Onboarding Receipt","type":"object","additionalProperties":false,"required":["schema_version","contract_version","record_type","receipt_id","host","status","generated_at","surface","current_host_evidence"],"properties":{"schema_version":{"const":1},"contract_version":{"const":"1.0.0"},"record_type":{"const":"onboarding-receipt"},"receipt_id":{"$ref":"lazyseries-host-evidence-defs.v1.schema.json#/$defs/id"},"host":{"$ref":"lazyseries-host-evidence-defs.v1.schema.json#/$defs/host"},"status":{"enum":["pending","observed","unsupported"]},"generated_at":{"$ref":"lazyseries-host-evidence-defs.v1.schema.json#/$defs/timestamp"},"surface":{"$ref":"lazyseries-host-evidence-defs.v1.schema.json#/$defs/surface"},"current_host_evidence":{"oneOf":[{"type":"null"},{"type":"object","additionalProperties":false,"required":["observation_id","sha256"],"properties":{"observation_id":{"$ref":"lazyseries-host-evidence-defs.v1.schema.json#/$defs/id"},"sha256":{"$ref":"lazyseries-host-evidence-defs.v1.schema.json#/$defs/sha256"}}}]}},"allOf":[{"if":{"properties":{"status":{"const":"observed"}}},"then":{"properties":{"surface":{"properties":{"freshness":{"properties":{"status":{"const":"current"},"observed_at":{"type":"string"},"expires_at":{"type":"string"}}}}},"current_host_evidence":{"type":"object"}}}},{"if":{"properties":{"status":{"enum":["pending","unsupported"]}}},"then":{"properties":{"surface":{"properties":{"freshness":{"properties":{"status":{"const":"pending"},"observed_at":{"type":"null"},"expires_at":{"type":"null"}}}}},"current_host_evidence":{"type":"null"}}}}]}
