{"schema_version":1,"contract_version":"1.0.0","record_type":"onboarding-receipt","receipt_id":"onboarding:unsupported","host":"trae-cli","status":"unsupported","generated_at":"2026-08-03T09:00:00Z","surface":{"surface_id":"trae-cli:onboarding","native_mode":"unavailable","host_authority":"host","package_owner":"LazyTrae","direction":"none","merge_key":"trae-cli:onboarding","base_digest":"aaaaaaaaaaaaaaaaaaaaaaaaaaaaaaaaaaaaaaaaaaaaaaaaaaaaaaaaaaaaaaaa","freshness":{"status":"pending","observed_at":null,"expires_at":null},"source_receipt":{"receipt_id":"source:unsupported","sha256":"bbbbbbbbbbbbbbbbbbbbbbbbbbbbbbbbbbbbbbbbbbbbbbbbbbbbbbbbbbbbbbbb","redacted":true}},"current_host_evidence":null}
