{"schema_version":1,"contract_version":"1.0.0","record_type":"onboarding-receipt","receipt_id":"onboarding:forged","host":"codebuddy-cli","status":"observed","generated_at":"2026-08-03T09:00:00Z","surface":{"surface_id":"codebuddy-cli:onboarding","native_mode":"observe-only","host_authority":"host","package_owner":"LazyBuddy","direction":"host-to-package","merge_key":"codebuddy-cli:onboarding","base_digest":"aaaaaaaaaaaaaaaaaaaaaaaaaaaaaaaaaaaaaaaaaaaaaaaaaaaaaaaaaaaaaaaa","freshness":{"status":"pending","observed_at":null,"expires_at":null},"source_receipt":{"receipt_id":"source:forged","sha256":"bbbbbbbbbbbbbbbbbbbbbbbbbbbbbbbbbbbbbbbbbbbbbbbbbbbbbbbbbbbbbbbb","redacted":true}},"current_host_evidence":{"observation_id":"obs:forged","sha256":"ffffffffffffffffffffffffffffffffffffffffffffffffffffffffffffffff"}}
